{
  "version": "0.1.0",
  "type": "prototypeContent",
  "id": "northstar-product-page-prototype-content",
  "name": "Northstar Product Page Prototype Content",
  "source": {
    "source": "generated",
    "confidence": "medium",
    "sourceRefs": [
      ".convention/examples/product-page-e2e/product-page.content-model.example.json",
      ".convention/examples/product-page-e2e/product-page.prototype-config.example.json",
      ".convention/examples/product-page-e2e/product-page.ui-blueprint.json"
    ],
    "notes": ["Fixture copy ties prototype screens, forms, dialogs, and messages back to blueprint node IDs."]
  },
  "sourceContentModelId": "northstar-product-page-content",
  "sourceContentModelRef": ".convention/examples/product-page-e2e/product-page.content-model.example.json",
  "sourcePrototypeConfigId": "northstar-product-page-prototype",
  "sourcePrototypeConfigRef": ".convention/examples/product-page-e2e/product-page.prototype-config.example.json",
  "screens": [
    {
      "screenId": "product-screen",
      "routeId": "product-route",
      "content": [
        {
          "nodeId": "product-summary",
          "contentRef": "content.product-summary",
          "copy": {
            "headline": {
              "value": "Northstar Beam 400 keeps the trail visible after dark",
              "source": "generated",
              "confidence": "medium",
              "status": "draft",
              "basedOn": ["product-page-clarity-before-cart"],
              "needsReview": ["productSpecs"]
            },
            "body": {
              "value": "Review brightness, battery, fit, and color before adding this rechargeable headlamp to your cart.",
              "source": "generated",
              "confidence": "medium",
              "status": "draft",
              "needsReview": ["productSpecs"]
            },
            "primaryCTA": {
              "value": "Add Selected Color to Cart",
              "source": "generated",
              "confidence": "high",
              "status": "draft"
            },
            "secondaryCTA": {
              "value": "Open Fit Guide",
              "source": "generated",
              "confidence": "high",
              "status": "draft"
            }
          },
          "review": {
            "status": "draft",
            "needsReview": ["productSpecs", "clientApproval"],
            "reviewNotes": ["Headline and body copy are prototype-ready only."]
          }
        },
        {
          "nodeId": "comparison-section",
          "contentRef": "content.comparison-section",
          "copy": {
            "heading": {
              "value": "Compare brightness, battery, and trail fit",
              "source": "generated",
              "confidence": "medium",
              "status": "draft",
              "needsReview": ["productSpecs"]
            },
            "body": {
              "value": "Use the comparison table to check whether the Beam 400 matches the length and intensity of your typical routes.",
              "source": "generated",
              "confidence": "medium",
              "status": "draft",
              "needsReview": ["productSpecs"]
            }
          },
          "review": {
            "status": "draft",
            "needsReview": ["productSpecs"],
            "reviewNotes": ["Comparison statements require final product data review."]
          }
        },
        {
          "nodeId": "product-details-tabs",
          "contentRef": "content.product-details-tabs",
          "copy": {
            "faqQuestion": {
              "value": "Can I use this headlamp for long evening routes?",
              "source": "generated",
              "confidence": "medium",
              "status": "draft",
              "needsReview": ["productSpecs"]
            },
            "faqAnswer": {
              "value": "Check the battery and brightness comparison before choosing the setup for your route length.",
              "source": "generated",
              "confidence": "medium",
              "status": "draft",
              "needsReview": ["productSpecs"]
            }
          },
          "review": {
            "status": "draft",
            "needsReview": ["productSpecs"],
            "reviewNotes": ["FAQ copy avoids exact runtime claims until specifications are approved."]
          }
        },
        {
          "nodeId": "store-footer",
          "contentRef": "content.store-footer",
          "copy": {
            "supportText": {
              "value": "Need help before checkout? Product support can answer fit, battery, and order questions.",
              "source": "generated",
              "confidence": "medium",
              "status": "draft",
              "needsReview": ["clientApproval"]
            }
          },
          "review": {
            "status": "draft",
            "needsReview": ["clientApproval"],
            "reviewNotes": ["Support wording should match the final store policy."]
          }
        }
      ]
    }
  ],
  "dialogs": [
    {
      "nodeId": "size-guide-dialog",
      "contentRef": "content.size-guide-dialog",
      "copy": {
        "title": {
          "value": "Find a comfortable headlamp fit",
          "source": "generated",
          "confidence": "medium",
          "status": "draft"
        },
        "description": {
          "value": "Check strap adjustment and intended activity before choosing your color.",
          "source": "generated",
          "confidence": "medium",
          "status": "draft",
          "needsReview": ["productSpecs"]
        },
        "secondaryCTA": {
          "value": "Close Guide",
          "source": "generated",
          "confidence": "high",
          "status": "draft"
        }
      },
      "review": {
        "status": "draft",
        "needsReview": ["productSpecs"],
        "reviewNotes": ["Dialog copy is advisory and requires product documentation review."]
      }
    }
  ],
  "forms": [
    {
      "formId": "variant-selection-form",
      "nodeId": "variant-selector-card",
      "title": {
        "value": "Choose a color",
        "source": "generated",
        "confidence": "high",
        "status": "draft"
      },
      "description": {
        "value": "Pick one color before adding the headlamp to your cart.",
        "source": "generated",
        "confidence": "high",
        "status": "draft"
      },
      "fields": [
        {
          "fieldId": "color-variant-field",
          "nodeId": "variant-selector-card",
          "label": {
            "value": "Color",
            "source": "generated",
            "confidence": "high",
            "status": "draft"
          },
          "helperText": {
            "value": "Select the color you want shipped.",
            "source": "generated",
            "confidence": "high",
            "status": "draft"
          },
          "errorText": {
            "value": "Choose a color to continue.",
            "source": "generated",
            "confidence": "high",
            "status": "draft"
          }
        }
      ],
      "actions": {
        "submit": {
          "value": "Add Selected Color to Cart",
          "source": "generated",
          "confidence": "high",
          "status": "draft"
        }
      },
      "review": {
        "status": "draft",
        "needsReview": [],
        "reviewNotes": ["Required-field microcopy is generic and safe for prototype use."]
      }
    }
  ],
  "messages": [
    {
      "id": "variant-error-message",
      "kind": "error",
      "nodeId": "variant-error-text",
      "copy": {
        "message": {
          "value": "Choose a color to continue.",
          "source": "generated",
          "confidence": "high",
          "status": "draft"
        }
      },
      "review": {
        "status": "draft",
        "needsReview": [],
        "reviewNotes": ["Validation message mirrors the form field error."]
      }
    },
    {
      "id": "cart-success-message",
      "kind": "confirmation",
      "nodeId": "cart-feedback-banner",
      "copy": {
        "message": {
          "value": "Added to your cart. Review your selected color before checkout.",
          "source": "generated",
          "confidence": "medium",
          "status": "draft",
          "needsReview": ["clientApproval"]
        },
        "primaryCTA": {
          "value": "Continue to Checkout",
          "source": "generated",
          "confidence": "high",
          "status": "draft"
        }
      },
      "review": {
        "status": "draft",
        "needsReview": ["clientApproval"],
        "reviewNotes": ["Confirmation and checkout wording should match the final cart flow."]
      }
    },
    {
      "id": "cart-error-message",
      "kind": "error",
      "nodeId": "cart-error-banner",
      "copy": {
        "message": {
          "value": "We could not update your cart. Check your selection and try again.",
          "source": "generated",
          "confidence": "high",
          "status": "draft"
        }
      },
      "review": {
        "status": "draft",
        "needsReview": [],
        "reviewNotes": ["Recovery copy avoids unsupported cause claims."]
      }
    },
    {
      "id": "cart-toast-message",
      "kind": "toast",
      "nodeId": "cart-toast",
      "copy": {
        "message": {
          "value": "Headlamp added to cart.",
          "source": "generated",
          "confidence": "high",
          "status": "draft"
        }
      },
      "review": {
        "status": "draft",
        "needsReview": [],
        "reviewNotes": ["Toast copy is short and state-specific."]
      }
    },
    {
      "id": "footer-support-message",
      "kind": "inlineHelp",
      "nodeId": "store-footer",
      "copy": {
        "message": {
          "value": "Need help before checkout? Product support can answer fit, battery, and order questions.",
          "source": "generated",
          "confidence": "medium",